{
  "schema_version": "v1",
  "run_id": "run-123",
  "test_name": "swebench-multi-step",
  "tag": "baseline",
  "start_ts": "2026-10-22T01:20:00Z",
  "end_ts": "2026-10-22T01:25:00Z",
  "steady_start_ts": "2026-10-22T01:21:00Z",
  "steady_end_ts": "2026-10-22T01:24:30Z",
  "cluster": "gke-rlbench-1",
  "sut_endpoint": "ate-env-api.default.svc.cluster.local:8080",
  "metadata": {
    "harness": "swe-perf",
    "git_sha": "abc1234"
  }
}
